{
  "id": 1434614,
  "title": "Source code for CoughCLIP",
  "doi": "10.6084/m9.figshare.1434614",
  "handle": "111184/figshare.1234",
  "url": "https://api.figshare.com/v2/articles/1434614",
  "url_public_html": "https://figshare.com/articles/software/Source_code_for_CoughCLIP/1434614",
  "url_public_api": "https://api.figshare.com/v2/articles/1434614",
  "url_private_html": "https://figshare.com/account/articles/1434614",
  "url_private_api": "https://api.figshare.com/v2/account/articles/1434614",
  "timeline": {
    "posted": "2025-05-18T11:49:03Z",
    "firstOnline": "2025-05-18T11:49:03Z"
  },
  "thumb": "https://ndownloader.figshare.com/files/123456789/preview/12345678/thumb.png",
  "defined_type": 9,
  "defined_type_name": "software",
  "resource_doi": "",
  "resource_title": "",
  "created_date": "2025-05-18T11:49:03Z"
}
